{
  "card_rule_count": 250,
  "catalog_kind": "dbs_effect_catalog",
  "effect_rule_count": 332,
  "rules": {
    "1000": [
      {
        "family_id": "self_attacks:auto_draw_n",
        "handler_id": "auto_draw_n",
        "handler_params": {
          "amount": 2
        },
        "limit_per_turn": null,
        "limit_scope": "card_number",
        "once_per_turn": true,
        "provenance": "extractor",
        "trigger": "self_attacks"
      }
    ],
    "1001": [
      {
        "family_id": "self_activate_main:auto_draw_n",
        "handler_id": "auto_draw_n",
        "handler_params": {
          "amount": 1,
          "requires_leader": "if your leader is mono-blue and you discard 1 extra from your hand"
        },
        "limit_per_turn": null,
        "limit_scope": "card_number",
        "once_per_turn": true,
        "provenance": "extractor",
        "trigger": "self_activate_main"
      },
      {
        "family_id": "self_activate_main:activate_draw_n_and_gain_keyword_for_turn",
        "handler_id": "activate_draw_n_and_gain_keyword_for_turn",
        "handler_params": {
          "amount": 1,
          "grant_keyword": "Critical",
          "requires_leader": "if your leader is mono-blue and you discard 1 extra from your hand"
        },
        "limit_per_turn": null,
        "limit_scope": "card_number",
        "once_per_turn": true,
        "provenance": "extractor",
        "trigger": "self_activate_main"
      }
    ],
    "1002": [
      {
        "family_id": "self_played:auto_place_all_opponent_battles_up_to_cost_under_self_on_play",
        "handler_id": "auto_place_all_opponent_battles_up_to_cost_under_self_on_play",
        "handler_params": {
          "max_cost": 5
        },
        "limit_per_turn": null,
        "limit_scope": "card_number",
        "once_per_turn": false,
        "provenance": "manual_override",
        "trigger": "self_played"
      },
      {
        "family_id": "self_activate_main:activate_drop_all_under_self_switch_self_active_and_gain_keyword_if_dropped_n",
        "handler_id": "activate_drop_all_under_self_switch_self_active_and_gain_keyword_if_dropped_n",
        "handler_params": {
          "grant_keyword": "Triple Strike",
          "min_released_for_keyword": 4,
          "required_source_zone": "battle"
        },
        "limit_per_turn": null,
        "limit_scope": "card_number",
        "once_per_turn": false,
        "provenance": "manual_override",
        "trigger": "self_activate_main"
      }
    ],
    "1003": [
      {
        "family_id": "self_played:auto_draw_n",
        "handler_id": "auto_draw_n",
        "handler_params": {
          "amount": 1,
          "ignores_barrier": true
        },
        "limit_per_turn": null,
        "limit_scope": "card_number",
        "once_per_turn": false,
        "provenance": "extractor",
        "trigger": "self_played"
      },
      {
        "family_id": "self_activate_main:auto_draw_n",
        "handler_id": "auto_draw_n",
        "handler_params": {
          "amount": 1,
          "ignores_barrier": true
        },
        "limit_per_turn": null,
        "limit_scope": "card_number",
        "once_per_turn": false,
        "provenance": "extractor",
        "trigger": "self_activate_main"
      }
    ],
    "1004": [
      {
        "family_id": "self_activate_main:auto_draw_n",
        "handler_id": "auto_draw_n",
        "handler_params": {
          "amount": 1
        },
        "limit_per_turn": null,
        "limit_scope": "card_number",
        "once_per_turn": true,
        "provenance": "extractor",
        "trigger": "self_activate_main"
      },
      {
        "family_id": "self_activate_main:activate_add_up_to_n_from_owner_deck_to_hand",
        "handler_id": "activate_add_up_to_n_from_owner_deck_to_hand",
        "handler_params": {
          "max_cost": -1,
          "max_targets": 1,
          "required_characters": "Lt Paikuhan Gt"
        },
        "limit_per_turn": null,
        "limit_scope": "card_number",
        "once_per_turn": true,
        "provenance": "extractor",
        "trigger": "self_activate_main"
      }
    ],
    "1005": [
      {
        "family_id": "self_played:auto_draw_n",
        "handler_id": "auto_draw_n",
        "handler_params": {
          "amount": 1
        },
        "limit_per_turn": 1,
        "limit_scope": "card_number",
        "once_per_turn": false,
        "provenance": "extractor",
        "trigger": "self_played"
      },
      {
        "family_id": "turn_end:auto_switch_self_active_on_turn_end",
        "handler_id": "auto_switch_self_active_on_turn_end",
        "handler_params": {},
        "limit_per_turn": 1,
        "limit_scope": "card_number",
        "once_per_turn": false,
        "provenance": "extractor",
        "trigger": "turn_end"
      },
      {
        "family_id": "self_activate_main:activate_play_self_from_hand",
        "handler_id": "activate_play_self_from_hand",
        "handler_params": {},
        "limit_per_turn": 1,
        "limit_scope": "card_number",
        "once_per_turn": false,
        "provenance": "extractor",
        "trigger": "self_activate_main"
      }
    ],
    "1006": [
      {
        "family_id": "self_activate_main:activate_play_self_from_hand",
        "handler_id": "activate_play_self_from_hand",
        "handler_params": {
          "min_owner_energy": 3
        },
        "limit_per_turn": 1,
        "limit_scope": "card_number",
        "once_per_turn": false,
        "provenance": "extractor",
        "trigger": "self_activate_main"
      }
    ],
    "1008": [
      {
        "family_id": "self_activate_main:auto_look_top_add_up_to_one_to_hand_on_play",
        "handler_id": "auto_look_top_add_up_to_one_to_hand_on_play",
        "handler_params": {
          "allowed_colors": "blue",
          "look_count": 1,
          "max_add": 1,
          "max_cost": -1,
          "required_characters": "Lt Paikuhan Gt",
          "rest_mode_only": true
        },
        "limit_per_turn": null,
        "limit_scope": "card_number",
        "once_per_turn": true,
        "provenance": "extractor",
        "trigger": "self_activate_main"
      }
    ],
    "1009": [
      {
        "family_id": "self_activate_main:activate_play_self_from_hand",
        "handler_id": "activate_play_self_from_hand",
        "handler_params": {
          "ignores_barrier": true,
          "required_leader_traits": "Blue <Paikuhan>",
          "requires_leader": "if your leader is a blue <paikuhan> card and you return this card to its owner's hand",
          "rest_mode_only": true,
          "resting": true
        },
        "limit_per_turn": null,
        "limit_scope": "card_number",
        "once_per_turn": false,
        "provenance": "extractor",
        "trigger": "self_activate_main"
      }
    ],
    "1011": [
      {
        "family_id": "self_played:auto_draw_n",
        "handler_id": "auto_draw_n",
        "handler_params": {
          "amount": 1,
          "required_leader_traits": "Blue \u226aAnother World Budokai\u226b",
          "requires_leader": "if your leader is a blue \u226aanother world budokai\u226b card, you send this card to its owner's warp, and discard 1 {angel halo} from your hand"
        },
        "limit_per_turn": 1,
        "limit_scope": "card_number",
        "once_per_turn": false,
        "provenance": "extractor",
        "trigger": "self_played"
      },
      {
        "family_id": "self_activate_main:activate_add_up_to_n_from_owner_warp_to_hand",
        "handler_id": "activate_add_up_to_n_from_owner_warp_to_hand",
        "handler_params": {
          "allowed_colors": "blue",
          "max_add": 1,
          "max_cost": -1,
          "required_characters": "An Energy Cost Between 3 And 7",
          "required_leader_traits": "Blue \u226aAnother World Budokai\u226b",
          "required_source_zone": "unison",
          "required_traits": "Another World Budokai",
          "requires_leader": "if your leader is a blue \u226aanother world budokai\u226b card, you send this card to its owner's warp, and discard 1 {angel halo} from your hand"
        },
        "limit_per_turn": 1,
        "limit_scope": "card_number",
        "once_per_turn": false,
        "provenance": "extractor",
        "trigger": "self_activate_main"
      }
    ],
    "1013": [
      {
        "family_id": "self_played:auto_draw_n",
        "handler_id": "auto_draw_n",
        "handler_params": {
          "amount": 1
        },
        "limit_per_turn": 1,
        "limit_scope": "card_number",
        "once_per_turn": false,
        "provenance": "extractor",
        "trigger": "self_played"
      },
      {
        "family_id": "self_activate_main:activate_play_self_from_warp",
        "handler_id": "activate_play_self_from_warp",
        "handler_params": {
          "required_source_zone": "warp"
        },
        "limit_per_turn": 1,
        "limit_scope": "card_number",
        "once_per_turn": false,
        "provenance": "extractor",
        "trigger": "self_activate_main"
      }
    ],
    "1015": [
      {
        "family_id": "self_played:auto_look_top_add_up_to_one_to_hand_on_play",
        "handler_id": "auto_look_top_add_up_to_one_to_hand_on_play",
        "handler_params": {
          "allowed_colors": "blue",
          "look_count": 5,
          "max_add": 1,
          "max_cost": 5,
          "required_characters": "Both And,1 Unison A Specified Cost Of 2",
          "required_traits": "Another World Budokai,West Galaxy Warrior"
        },
        "limit_per_turn": null,
        "limit_scope": "card_number",
        "once_per_turn": false,
        "provenance": "extractor",
        "trigger": "self_played"
      }
    ],
    "1017": [
      {
        "family_id": "self_comboed:auto_draw_n",
        "handler_id": "auto_draw_n",
        "handler_params": {
          "amount": 1,
          "max_owner_life": 4,